24ARS-NKI0048	NA	24ARS-NKI0048_00548	1	4245	+	fdeC	inverse autotransporter adhesin FdeC	plus	VIRULENCE	VIRULENCE	NA	NA	BLASTX	1415	1416	100.00	96.75	1416	ABE05822.1	inverse autotransporter adhesin FdeC	NA	NA
24ARS-NKI0048	NA	24ARS-NKI0048_00984	1	1002	+	blaEC	BlaEC family class C beta-lactamase	plus	AMR	AMR	BETA-LACTAM	BETA-LACTAM	PARTIAL_CONTIG_ENDX	334	377	88.59	99.10	334	AAZ85965.1	cephalosporin-hydrolyzing class C beta-lactamase EC-5	NA	NA
24ARS-NKI0048	NA	24ARS-NKI0048_01685	1	423	+	arsC	glutaredoxin-dependent arsenate reductase	plus	STRESS	METAL	ARSENIC	ARSENATE	BLASTX	141	141	100.00	92.20	141	AAA21096.1	glutaredoxin-dependent arsenate reductase	NA	NA
24ARS-NKI0048	NA	24ARS-NKI0048_02351	1	291	+	iss	increased serum survival lipoprotein Iss	plus	VIRULENCE	VIRULENCE	NA	NA	EXACTX	97	97	100.00	100.00	97	ADN71659.1	increased serum survival lipoprotein Iss	NA	NA
24ARS-NKI0048	NA	24ARS-NKI0048_02388	1	264	+	ariR	biofilm/acid-resistance regulator AriR	plus	STRESS	ACID	NA	NA	BLASTX	88	88	100.00	97.73	88	AAC74250.1	biofilm/acid-resistance regulator AriR	NA	NA
24ARS-NKI0048	NA	24ARS-NKI0048_02692	1	3102	+	acrF	multidrug efflux RND transporter permease subunit AcrF	plus	AMR	AMR	EFFLUX	EFFLUX	BLASTX	1034	1034	100.00	99.52	1034	AAC76298.1	multidrug efflux RND transporter permease subunit AcrF	NA	NA
24ARS-NKI0048	NA	24ARS-NKI0048_02753	1	900	+	fieF	CDF family cation-efflux transporter FieF	plus	STRESS	METAL	NA	NA	BLASTX	300	300	100.00	99.67	300	BAE77395.1	CDF family cation-efflux transporter FieF	NA	NA
24ARS-NKI0048	NA	24ARS-NKI0048_03255	1	330	+	emrE	multidrug efflux SMR transporter EmrE	plus	STRESS	BIOCIDE	EFFLUX	EFFLUX	BLASTX	110	110	100.00	98.18	110	CAA77936.1	multidrug efflux SMR transporter EmrE	NA	NA
24ARS-NKI0048	NA	24ARS-NKI0048_03725	1	1182	+	emrD	multidrug efflux MFS transporter EmrD	plus	AMR	AMR	EFFLUX	EFFLUX	BLASTX	394	394	100.00	98.98	394	BAE77620.1	multidrug efflux MFS transporter EmrD	NA	NA
24ARS-NKI0048	NA	24ARS-NKI0048_03838	1	306	+	asr	acid resistance repetitive basic protein Asr	plus	STRESS	ACID	NA	NA	BLASTX	102	102	100.00	98.04	102	BAA15331.2	acid resistance repetitive basic protein Asr	NA	NA
24ARS-NKI0048	NA	24ARS-NKI0048_04072	1	1710	+	ybtP	yersiniabactin ABC transporter ATP-binding/permease protein YbtP	plus	VIRULENCE	VIRULENCE	NA	NA	BLASTX	570	600	95.00	99.47	570	CAA21388.1	yersiniabactin ABC transporter ATP-binding/permease protein YbtP	NA	NA
24ARS-NKI0048	NA	24ARS-NKI0048_04073	1	1800	+	ybtQ	yersiniabactin ABC transporter ATP-binding/permease protein YbtQ	plus	VIRULENCE	VIRULENCE	NA	NA	BLASTX	600	600	100.00	99.50	600	AAC69584.1	yersiniabactin ABC transporter ATP-binding/permease protein YbtQ	NA	NA
24ARS-NKI0048	NA	24ARS-NKI0048_04109	1	1227	+	mdtM	multidrug efflux MFS transporter MdtM	plus	AMR	AMR	EFFLUX	EFFLUX	BLASTX	409	410	99.76	97.31	409	AAC77293.1	multidrug efflux MFS transporter MdtM	NA	NA
24ARS-NKI0048	NA	24ARS-NKI0048_04254	1	2580	+	afaC	AfaC-I/III family usher protein	plus	VIRULENCE	VIRULENCE	NA	NA	BLASTX	860	860	100.00	99.19	860	CAW30799.1	AfaC-I/III family usher protein	NA	NA
24ARS-NKI0048	NA	24ARS-NKI0048_04255	1	717	+	nfaE	Dr family non-fimbrial adhesin I chaperone NfaE	plus	VIRULENCE	VIRULENCE	NA	NA	BLASTX	239	247	96.76	100.00	239	CAW30811.1	Dr family non-fimbrial adhesin I chaperone NfaE	NA	NA
24ARS-NKI0048	NA	24ARS-NKI0048_04531	1	285	+	papA	P fimbria major subunit PapA	plus	VIRULENCE	VIRULENCE	NA	NA	PARTIALX	95	185	51.89	87.50	96	CAA43562.1	P fimbria major subunit PapA	NA	NA
24ARS-NKI0048	NA	24ARS-NKI0048_04540	1	1722	+	iucA	aerobactin synthase IucA	plus	VIRULENCE	VIRULENCE	NA	NA	BLASTX	574	576	100.00	98.61	576	EGI25746.1	aerobactin synthase IucA	NA	NA
24ARS-NKI0048	NA	24ARS-NKI0048_04541	1	945	+	iucB	N(6)-hydroxylysine O-acetyltransferase IucB	plus	VIRULENCE	VIRULENCE	NA	NA	BLASTX	315	315	100.00	99.37	315	AAN82074.1	N(6)-hydroxylysine O-acetyltransferase IucB	NA	NA
24ARS-NKI0048	NA	24ARS-NKI0048_04542	1	1740	+	iucC	NIS family aerobactin synthetase IucC	plus	VIRULENCE	VIRULENCE	NA	NA	BLASTX	580	580	100.00	99.14	580	AAN82073.1	NIS family aerobactin synthetase IucC	NA	NA
24ARS-NKI0048	NA	24ARS-NKI0048_04543	1	1275	+	iucD	NADPH-dependent L-lysine N(6)-monooxygenase IucD	plus	VIRULENCE	VIRULENCE	NA	NA	BLASTX	425	445	95.51	97.65	425	AAD44749.1	NADPH-dependent L-lysine N(6)-monooxygenase IucD	NA	NA
24ARS-NKI0048	NA	24ARS-NKI0048_04544	13	2199	+	iutA	ferric aerobactin receptor IutA	plus	VIRULENCE	VIRULENCE	NA	NA	BLASTX	729	731	99.73	89.85	729	AAN45165.2	ferric aerobactin receptor IutA	NA	NA
24ARS-NKI0048	NA	24ARS-NKI0048_04545	1	3885	+	sat	serine protease autotransporter toxin Sat	plus	VIRULENCE	VIRULENCE	NA	NA	EXACTX	1295	1295	100.00	100.00	1295	CAE55775.1	serine protease autotransporter toxin Sat	NA	NA
24ARS-NKI0048	NA	24ARS-NKI0048_04555	1	2088	+	iha	bifunctional siderophore receptor/adhesin Iha	plus	VIRULENCE	VIRULENCE	NA	NA	EXACTX	696	696	100.00	100.00	696	ADN47767.1	bifunctional siderophore receptor/adhesin Iha	NA	NA
24ARS-NKI0048	NA	24ARS-NKI0048_04657	1	471	+	dfrA17	trimethoprim-resistant dihydrofolate reductase DfrA17	core	AMR	AMR	TRIMETHOPRIM	TRIMETHOPRIM	EXACTX	157	157	100.00	100.00	157	WP_001389366.1	trimethoprim-resistant dihydrofolate reductase DfrA17	NA	NA
24ARS-NKI0048	NA	24ARS-NKI0048_04658	1	786	+	aadA5	ANT(3'')-Ia family aminoglycoside nucleotidyltransferase AadA5	core	AMR	AMR	AMINOGLYCOSIDE	STREPTOMYCIN	EXACTX	262	262	100.00	100.00	262	WP_000503573.1	ANT(3'')-Ia family aminoglycoside nucleotidyltransferase AadA5	NA	NA
24ARS-NKI0048	NA	24ARS-NKI0048_04659	1	345	+	qacEdelta1	quaternary ammonium compound efflux SMR transporter QacE delta 1	core	STRESS	BIOCIDE	QUATERNARY AMMONIUM	QUATERNARY AMMONIUM	ALLELEX	115	115	100.00	100.00	115	WP_000679427.1	quaternary ammonium compound efflux SMR transporter QacE delta 1	NA	NA
24ARS-NKI0048	NA	24ARS-NKI0048_04660	1	837	+	sul1	sulfonamide-resistant dihydropteroate synthase Sul1	core	AMR	AMR	SULFONAMIDE	SULFONAMIDE	EXACTX	279	279	100.00	100.00	279	WP_000259031.1	sulfonamide-resistant dihydropteroate synthase Sul1	NA	NA
24ARS-NKI0048	NA	24ARS-NKI0048_04667	1	903	+	mph(A)	Mph(A) family macrolide 2'-phosphotransferase	core	AMR	AMR	MACROLIDE	AZITHROMYCIN/ERYTHROMYCIN/SPIRAMYCIN/TELITHROMYCIN	EXACTX	301	301	100.00	100.00	301	WP_000219391.1	Mph(A) family macrolide 2'-phosphotransferase	NA	NA
24ARS-NKI0048	NA	24ARS-NKI0048_04772	1	1197	+	tet(A)	tetracycline efflux MFS transporter Tet(A)	core	AMR	AMR	TETRACYCLINE	TETRACYCLINE	EXACTX	399	399	100.00	100.00	399	WP_000804064.1	tetracycline efflux MFS transporter Tet(A)	NA	NA
24ARS-NKI0048	NA	24ARS-NKI0048_04816	1	873	+	blaCTX-M-15	extended-spectrum class A beta-lactamase CTX-M-15	core	AMR	AMR	BETA-LACTAM	CEPHALOSPORIN	ALLELEX	291	291	100.00	100.00	291	WP_000239590.1	extended-spectrum class A beta-lactamase CTX-M-15	NA	NA
24ARS-NKI0048	NA	24ARS-NKI0048_04861	46	873	+	blaOXA-1	oxacillin-hydrolyzing class D beta-lactamase OXA-1	core	AMR	AMR	BETA-LACTAM	CEPHALOSPORIN	ALLELEX	276	276	100.00	100.00	276	WP_001334766.1	oxacillin-hydrolyzing class D beta-lactamase OXA-1	NA	NA
24ARS-NKI0048	NA	24ARS-NKI0048_04862	46	597	+	aac(6')-Ib-cr5	fluoroquinolone-acetylating aminoglycoside 6'-N-acetyltransferase AAC(6')-Ib-cr5	core	AMR	AMR	AMINOGLYCOSIDE/QUINOLONE	AMIKACIN/KANAMYCIN/QUINOLONE/TOBRAMYCIN	ALLELEX	184	184	100.00	100.00	184	WP_063840321.1	fluoroquinolone-acetylating aminoglycoside 6'-N-acetyltransferase AAC(6')-Ib-cr5	NA	NA
24ARS-DMC0098	NA	24ARS-DMC0098_00516	1	858	+	blaSHV-11	broad-spectrum class A beta-lactamase SHV-11	core	AMR	AMR	BETA-LACTAM	BETA-LACTAM	ALLELEX	286	286	100.00	100.00	286	WP_004176269.1	broad-spectrum class A beta-lactamase SHV-11	NA	NA
24ARS-DMC0098	NA	24ARS-DMC0098_02823	1	414	+	fosA	FosA5 family fosfomycin resistance glutathione transferase	core	AMR	AMR	FOSFOMYCIN	FOSFOMYCIN	BLASTX	138	139	99.28	99.28	138	WP_004146118.1	FosA5 family fosfomycin resistance glutathione transferase	NA	NA
24ARS-DMC0098	NA	24ARS-DMC0098_02880	1	1173	+	oqxA	multidrug efflux RND transporter periplasmic adaptor subunit OqxA	core	AMR	AMR	PHENICOL/QUINOLONE	PHENICOL/QUINOLONE	EXACTX	391	391	100.00	100.00	391	WP_002914189.1	multidrug efflux RND transporter periplasmic adaptor subunit OqxA	NA	NA
24ARS-DMC0098	NA	24ARS-DMC0098_02881	1	3150	+	oqxB25	multidrug efflux RND transporter permease subunit OqxB25	core	AMR	AMR	PHENICOL/QUINOLONE	PHENICOL/QUINOLONE	ALLELEX	1050	1050	100.00	100.00	1050	WP_016947602.1	multidrug efflux RND transporter permease subunit OqxB25	NA	NA
24ARS-DMC0098	NA	24ARS-DMC0098_03244	1	1230	+	kdeA	multidrug efflux MFS transporter KdeA	plus	AMR	AMR	EFFLUX	EFFLUX	BLASTX	410	410	100.00	99.76	410	ABR76310.1	multidrug efflux MFS transporter KdeA	NA	NA
24ARS-DMC0098	NA	24ARS-DMC0098_03975	1	1182	+	emrD	multidrug efflux MFS transporter EmrD	plus	AMR	AMR	EFFLUX	EFFLUX	BLASTX	394	394	100.00	99.49	394	ACN65732.1	multidrug efflux MFS transporter EmrD	NA	NA
24ARS-DMC0098	NA	24ARS-DMC0098_04265	1	858	+	blaTEM-1	broad-spectrum class A beta-lactamase TEM-1	core	AMR	AMR	BETA-LACTAM	BETA-LACTAM	ALLELEX	286	286	100.00	100.00	286	WP_000027057.1	broad-spectrum class A beta-lactamase TEM-1	NA	NA
24ARS-DMC0098	NA	24ARS-DMC0098_04270	1	873	+	blaCTX-M-15	extended-spectrum class A beta-lactamase CTX-M-15	core	AMR	AMR	BETA-LACTAM	CEPHALOSPORIN	ALLELEX	291	291	100.00	100.00	291	WP_000239590.1	extended-spectrum class A beta-lactamase CTX-M-15	NA	NA
24ARS-DMC0098	NA	24ARS-DMC0098_04324	1	900	+	fieF	CDF family cation-efflux transporter FieF	plus	STRESS	METAL	NA	NA	EXACTX	300	300	100.00	100.00	300	BAB89353.1	CDF family cation-efflux transporter FieF	NA	NA
24ARS-DMC0098	NA	24ARS-DMC0098_04839	1	453	+	terB	tellurium resistance membrane protein TerB	plus	STRESS	METAL	TELLURIUM	TELLURIUM	EXACTX	151	151	100.00	100.00	151	ACI12150.1	tellurium resistance membrane protein TerB	NA	NA
24ARS-DMC0098	NA	24ARS-DMC0098_04840	1	1038	+	terC	tellurium resistance membrane protein TerC	plus	STRESS	METAL	TELLURIUM	TELLURIUM	BLASTX	346	346	100.00	99.13	346	AAA98291.1	tellurium resistance membrane protein TerC	NA	NA
24ARS-DMC0098	NA	24ARS-DMC0098_04841	1	576	+	terD	tellurium resistance membrane protein TerD	plus	STRESS	METAL	TELLURIUM	TELLURIUM	BLASTX	192	192	100.00	98.96	192	AAA98292.1	tellurium resistance membrane protein TerD	NA	NA
24ARS-DMC0098	NA	24ARS-DMC0098_04842	1	573	+	terE	tellurium resistance cAMP binding protein TerE	plus	STRESS	METAL	TELLURIUM	TELLURIUM	BLASTX	191	191	100.00	99.48	191	AAA98293.1	tellurium resistance cAMP binding protein TerE	NA	NA
24ARS-DMC0098	NA	24ARS-DMC0098_04941	1	429	+	silE	silver-binding protein SilE	plus	STRESS	METAL	SILVER	SILVER	BLASTX	143	143	100.00	92.31	143	AAD11743.1	silver-binding protein SilE	NA	NA
24ARS-DMC0098	NA	24ARS-DMC0098_04942	1	1473	+	silS	copper/silver sensor histidine kinase SilS	plus	STRESS	METAL	COPPER/SILVER	COPPER/SILVER	BLASTX	491	491	100.00	98.98	491	SPD96882.1	copper/silver sensor histidine kinase SilS	NA	NA
24ARS-DMC0098	NA	24ARS-DMC0098_04943	1	678	+	silR	copper/silver response regulator transcription factor SilR	plus	STRESS	METAL	COPPER/SILVER	COPPER/SILVER	BLASTX	226	226	100.00	98.23	226	SPD96883.1	copper/silver response regulator transcription factor SilR	NA	NA
24ARS-DMC0098	NA	24ARS-DMC0098_04944	1	1383	+	silC	Cu(+)/Ag(+) efflux RND transporter outer membrane channel SilC	plus	STRESS	METAL	COPPER/SILVER	COPPER/SILVER	BLASTX	461	461	100.00	98.26	461	SPD96884.1	Cu(+)/Ag(+) efflux RND transporter outer membrane channel SilC	NA	NA
24ARS-DMC0098	NA	24ARS-DMC0098_04945	1	351	+	silF	Cu(+)/Ag(+) efflux RND transporter periplasmic metallochaperone SilF	plus	STRESS	METAL	COPPER/SILVER	COPPER/SILVER	BLASTX	117	117	100.00	99.15	117	KGL71342.1	Cu(+)/Ag(+) efflux RND transporter periplasmic metallochaperone SilF	NA	NA
24ARS-DMC0098	NA	24ARS-DMC0098_04946	1	1290	+	silB	Cu(+)/Ag(+) efflux RND transporter periplasmic adaptor subunit SilB	plus	STRESS	METAL	COPPER/SILVER	COPPER/SILVER	BLASTX	430	430	100.00	97.91	430	AAD11748.1	Cu(+)/Ag(+) efflux RND transporter periplasmic adaptor subunit SilB	NA	NA
24ARS-DMC0098	NA	24ARS-DMC0098_04947	1	3144	+	silA	Cu(+)/Ag(+) efflux RND transporter permease subunit SilA	plus	STRESS	METAL	COPPER/SILVER	COPPER/SILVER	BLASTX	1048	1048	100.00	98.85	1048	AAD11749.1	Cu(+)/Ag(+) efflux RND transporter permease subunit SilA	NA	NA
24ARS-DMC0098	NA	24ARS-DMC0098_04949	1	2445	+	silP	Ag(+)-translocating P-type ATPase SilP	plus	STRESS	METAL	SILVER	SILVER	BLASTX	815	824	98.79	94.61	816	AAD11750.1	Ag(+)-translocating P-type ATPase SilP	NA	NA
24ARS-DMC0098	NA	24ARS-DMC0098_04953	1	1815	+	pcoA	multicopper oxidase PcoA	plus	STRESS	METAL	COPPER	COPPER	EXACTX	605	605	100.00	100.00	605	CAA58525.1	multicopper oxidase PcoA	NA	NA
24ARS-DMC0098	NA	24ARS-DMC0098_04954	7	894	+	pcoB	copper-binding protein PcoB	plus	STRESS	METAL	COPPER	COPPER	BLASTX	296	296	100.00	99.66	296	CAA58526.1	copper-binding protein PcoB	NA	NA
24ARS-DMC0098	NA	24ARS-DMC0098_04955	1	378	+	pcoC	copper resistance system metallochaperone PcoC	plus	STRESS	METAL	COPPER	COPPER	EXACTX	126	126	100.00	100.00	126	CAA58527.1	copper resistance system metallochaperone PcoC	NA	NA
24ARS-DMC0098	NA	24ARS-DMC0098_04956	1	927	+	pcoD	copper resistance inner membrane protein PcoD	plus	STRESS	METAL	COPPER	COPPER	BLASTX	309	309	100.00	99.68	309	CAA58528.1	copper resistance inner membrane protein PcoD	NA	NA
24ARS-DMC0098	NA	24ARS-DMC0098_04957	1	678	+	pcoR	copper response regulator transcription factor PcoR	plus	STRESS	METAL	COPPER	COPPER	EXACTX	226	226	100.00	100.00	226	CAA58529.1	copper response regulator transcription factor PcoR	NA	NA
24ARS-DMC0098	NA	24ARS-DMC0098_04958	1	1398	+	pcoS	copper resistance membrane spanning protein PcoS	plus	STRESS	METAL	COPPER	COPPER	BLASTX	466	466	100.00	99.14	466	CAA58530.1	copper resistance membrane spanning protein PcoS	NA	NA
24ARS-DMC0098	NA	24ARS-DMC0098_05071	1	837	+	sul1	sulfonamide-resistant dihydropteroate synthase Sul1	core	AMR	AMR	SULFONAMIDE	SULFONAMIDE	EXACTX	279	279	100.00	100.00	279	WP_000259031.1	sulfonamide-resistant dihydropteroate synthase Sul1	NA	NA
24ARS-DMC0098	NA	24ARS-DMC0098_05072	1	345	+	qacEdelta1	quaternary ammonium compound efflux SMR transporter QacE delta 1	core	STRESS	BIOCIDE	QUATERNARY AMMONIUM	QUATERNARY AMMONIUM	ALLELEX	115	115	100.00	100.00	115	WP_000679427.1	quaternary ammonium compound efflux SMR transporter QacE delta 1	NA	NA
24ARS-DMC0098	NA	24ARS-DMC0098_05073	1	843	+	aadA16	ANT(3'')-Ia family aminoglycoside nucleotidyltransferase AadA16	core	AMR	AMR	AMINOGLYCOSIDE	STREPTOMYCIN	EXACTX	281	281	100.00	100.00	281	WP_001749984.1	ANT(3'')-Ia family aminoglycoside nucleotidyltransferase AadA16	NA	NA
24ARS-DMC0098	NA	24ARS-DMC0098_05075	1	450	+	arr-3	NAD(+)--rifampin ADP-ribosyltransferase Arr-3	core	AMR	AMR	RIFAMYCIN	RIFAMYCIN	EXACTX	150	150	100.00	100.00	150	WP_001749986.1	NAD(+)--rifampin ADP-ribosyltransferase Arr-3	NA	NA
24ARS-DMC0098	NA	24ARS-DMC0098_05076	46	597	+	aac(6')-Ib-cr5	fluoroquinolone-acetylating aminoglycoside 6'-N-acetyltransferase AAC(6')-Ib-cr5	core	AMR	AMR	AMINOGLYCOSIDE/QUINOLONE	AMIKACIN/KANAMYCIN/QUINOLONE/TOBRAMYCIN	ALLELEX	184	184	100.00	100.00	184	WP_063840321.1	fluoroquinolone-acetylating aminoglycoside 6'-N-acetyltransferase AAC(6')-Ib-cr5	NA	NA
24ARS-DMC0098	NA	24ARS-DMC0098_05083	1	903	+	mph(A)	Mph(A) family macrolide 2'-phosphotransferase	core	AMR	AMR	MACROLIDE	AZITHROMYCIN/ERYTHROMYCIN/SPIRAMYCIN/TELITHROMYCIN	EXACTX	301	301	100.00	100.00	301	WP_000219391.1	Mph(A) family macrolide 2'-phosphotransferase	NA	NA
24ARS-DMC0098	NA	24ARS-DMC0098_05092	1	1197	+	tet(A)	tetracycline efflux MFS transporter Tet(A)	core	AMR	AMR	TETRACYCLINE	TETRACYCLINE	EXACTX	399	399	100.00	100.00	399	WP_000804064.1	tetracycline efflux MFS transporter Tet(A)	NA	NA
24ARS-DMC0098	NA	24ARS-DMC0098_05118	1	858	+	aac(3)-IId	aminoglycoside N-acetyltransferase AAC(3)-IId	core	AMR	AMR	AMINOGLYCOSIDE	GENTAMICIN	EXACTX	286	286	100.00	100.00	286	WP_000557454.1	aminoglycoside N-acetyltransferase AAC(3)-IId	NA	NA
24ARS-DMC0102	NA	24ARS-DMC0102_02179	1	786	+	blaOXA-486	OXA-50 family oxacillin-hydrolyzing class D beta-lactamase OXA-486	core	AMR	AMR	BETA-LACTAM	BETA-LACTAM	ALLELEX	262	262	100.00	100.00	262	WP_003161965.1	OXA-50 family oxacillin-hydrolyzing class D beta-lactamase OXA-486	NA	NA
24ARS-DMC0102	NA	24ARS-DMC0102_02817	1	405	+	fosA	FosA family fosfomycin resistance glutathione transferase	core	AMR	AMR	FOSFOMYCIN	FOSFOMYCIN	BLASTX	135	135	100.00	99.26	135	WP_003082280.1	FosA family fosfomycin resistance glutathione transferase	NA	NA
24ARS-DMC0102	NA	24ARS-DMC0102_02874	1	636	+	catB7	type B-4 chloramphenicol O-acetyltransferase CatB7	core	AMR	AMR	PHENICOL	CHLORAMPHENICOL	BLASTX	212	212	100.00	98.11	212	WP_003112709.1	type B-4 chloramphenicol O-acetyltransferase CatB7	NA	NA
24ARS-DMC0102	NA	24ARS-DMC0102_03093	1	1191	+	blaPDC-5	extended-spectrum class C beta-lactamase PDC-5	core	AMR	AMR	BETA-LACTAM	CEPHALOSPORIN	ALLELEX	397	397	100.00	100.00	397	WP_003119095.1	extended-spectrum class C beta-lactamase PDC-5	NA	NA
24ARS-DMC0102	NA	24ARS-DMC0102_03102	1	804	+	aph(3')-IIb	aminoglycoside O-phosphotransferase APH(3')-IIb	core	AMR	AMR	AMINOGLYCOSIDE	KANAMYCIN	BLASTX	268	268	100.00	99.63	268	WP_003113011.1	aminoglycoside O-phosphotransferase APH(3')-IIb	NA	NA
24ARS-DMC0102	NA	24ARS-DMC0102_03806	1	1149	+	mexA	multidrug efflux RND transporter periplasmic adaptor subunit MexA	plus	AMR	AMR	EFFLUX	EFFLUX	EXACTX	383	383	100.00	100.00	383	AAA74436.1	multidrug efflux RND transporter periplasmic adaptor subunit MexA	NA	NA
24ARS-DMC0102	NA	24ARS-DMC0102_04209	1	1242	+	mexE	MexE family multidrug efflux RND transporter periplasmic adaptor subunit	plus	AMR	AMR	EFFLUX	EFFLUX	BLASTX	414	414	100.00	99.76	414	AAG05881.1	MexE family multidrug efflux RND transporter periplasmic adaptor subunit	NA	NA
24ARS-DMC0102	NA	24ARS-DMC0102_04789	1	1188	+	mexX	multidrug efflux RND transporter periplasmic adaptor subunit MexX	plus	AMR	AMR	EFFLUX	EFFLUX	BLASTX	396	396	100.00	98.99	396	AAF14522.1	multidrug efflux RND transporter periplasmic adaptor subunit MexX	NA	NA
24ARS-JLM0020	NA	24ARS-JLM0020_00941	1	417	+	fosA	FosA5 family fosfomycin resistance glutathione transferase	core	AMR	AMR	FOSFOMYCIN	FOSFOMYCIN	BLASTX	139	139	100.00	97.12	139	WP_004146118.1	FosA5 family fosfomycin resistance glutathione transferase	NA	NA
24ARS-JLM0020	NA	24ARS-JLM0020_00999	1	1173	+	oqxA	multidrug efflux RND transporter periplasmic adaptor subunit OqxA	core	AMR	AMR	PHENICOL/QUINOLONE	PHENICOL/QUINOLONE	BLASTX	391	391	100.00	96.68	391	WP_002914189.1	multidrug efflux RND transporter periplasmic adaptor subunit OqxA	NA	NA
24ARS-JLM0020	NA	24ARS-JLM0020_01000	1	3150	+	oqxB	multidrug efflux RND transporter permease subunit OqxB	core	AMR	AMR	PHENICOL/QUINOLONE	PHENICOL/QUINOLONE	BLASTX	1050	1050	100.00	99.14	1050	WP_012967412.1	multidrug efflux RND transporter permease subunit OqxB9	NA	NA
24ARS-JLM0020	NA	24ARS-JLM0020_01537	1	858	+	blaOKP-B	OKP-B family broad-spectrum class A beta-lactamase	core	AMR	AMR	BETA-LACTAM	BETA-LACTAM	BLASTX	286	286	100.00	99.65	286	WP_063860915.1	broad-spectrum class A beta-lactamase OKP-B-20	NA	NA
24ARS-JLM0020	NA	24ARS-JLM0020_02784	1	1182	+	emrD	multidrug efflux MFS transporter EmrD	plus	AMR	AMR	EFFLUX	EFFLUX	BLASTX	394	394	100.00	98.48	394	ACN65732.1	multidrug efflux MFS transporter EmrD	NA	NA
24ARS-JLM0020	NA	24ARS-JLM0020_03367	1	900	+	fieF	CDF family cation-efflux transporter FieF	plus	STRESS	METAL	NA	NA	EXACTX	300	300	100.00	100.00	300	BAB89353.1	CDF family cation-efflux transporter FieF	NA	NA
24ARS-JLM0020	NA	24ARS-JLM0020_04342	1	1230	+	kdeA	multidrug efflux MFS transporter KdeA	plus	AMR	AMR	EFFLUX	EFFLUX	BLASTX	410	410	100.00	99.02	410	ABR76310.1	multidrug efflux MFS transporter KdeA	NA	NA
24ARS-JLM0020	NA	24ARS-JLM0020_04712	1	1197	+	tet(A)	tetracycline efflux MFS transporter Tet(A)	core	AMR	AMR	TETRACYCLINE	TETRACYCLINE	EXACTX	399	399	100.00	100.00	399	WP_000804064.1	tetracycline efflux MFS transporter Tet(A)	NA	NA
24ARS-JLM0020	NA	24ARS-JLM0020_04730	1	453	+	terB	tellurium resistance membrane protein TerB	plus	STRESS	METAL	TELLURIUM	TELLURIUM	EXACTX	151	151	100.00	100.00	151	ACI12150.1	tellurium resistance membrane protein TerB	NA	NA
24ARS-JLM0020	NA	24ARS-JLM0020_04731	1	1038	+	terC	tellurium resistance membrane protein TerC	plus	STRESS	METAL	TELLURIUM	TELLURIUM	BLASTX	346	346	100.00	99.13	346	AAA98291.1	tellurium resistance membrane protein TerC	NA	NA
24ARS-JLM0020	NA	24ARS-JLM0020_04732	1	576	+	terD	tellurium resistance membrane protein TerD	plus	STRESS	METAL	TELLURIUM	TELLURIUM	BLASTX	192	192	100.00	98.96	192	AAA98292.1	tellurium resistance membrane protein TerD	NA	NA
24ARS-JLM0020	NA	24ARS-JLM0020_04733	1	573	+	terE	tellurium resistance cAMP binding protein TerE	plus	STRESS	METAL	TELLURIUM	TELLURIUM	BLASTX	191	191	100.00	99.48	191	AAA98293.1	tellurium resistance cAMP binding protein TerE	NA	NA
24ARS-JLM0020	NA	24ARS-JLM0020_04803	1	1398	+	pcoS	copper resistance membrane spanning protein PcoS	plus	STRESS	METAL	COPPER	COPPER	BLASTX	466	466	100.00	99.14	466	CAA58530.1	copper resistance membrane spanning protein PcoS	NA	NA
24ARS-JLM0020	NA	24ARS-JLM0020_04804	1	678	+	pcoR	copper response regulator transcription factor PcoR	plus	STRESS	METAL	COPPER	COPPER	EXACTX	226	226	100.00	100.00	226	CAA58529.1	copper response regulator transcription factor PcoR	NA	NA
24ARS-JLM0020	NA	24ARS-JLM0020_04805	1	927	+	pcoD	copper resistance inner membrane protein PcoD	plus	STRESS	METAL	COPPER	COPPER	BLASTX	309	309	100.00	99.68	309	CAA58528.1	copper resistance inner membrane protein PcoD	NA	NA
24ARS-JLM0020	NA	24ARS-JLM0020_04806	1	378	+	pcoC	copper resistance system metallochaperone PcoC	plus	STRESS	METAL	COPPER	COPPER	EXACTX	126	126	100.00	100.00	126	CAA58527.1	copper resistance system metallochaperone PcoC	NA	NA
24ARS-JLM0020	NA	24ARS-JLM0020_04807	7	894	+	pcoB	copper-binding protein PcoB	plus	STRESS	METAL	COPPER	COPPER	BLASTX	296	296	100.00	99.66	296	CAA58526.1	copper-binding protein PcoB	NA	NA
24ARS-JLM0020	NA	24ARS-JLM0020_04808	1	1815	+	pcoA	multicopper oxidase PcoA	plus	STRESS	METAL	COPPER	COPPER	EXACTX	605	605	100.00	100.00	605	CAA58525.1	multicopper oxidase PcoA	NA	NA
24ARS-JLM0020	NA	24ARS-JLM0020_04812	1	2445	+	silP	Ag(+)-translocating P-type ATPase SilP	plus	STRESS	METAL	SILVER	SILVER	BLASTX	815	824	98.79	94.73	816	AAD11750.1	Ag(+)-translocating P-type ATPase SilP	NA	NA
24ARS-JLM0020	NA	24ARS-JLM0020_04814	1	3144	+	silA	Cu(+)/Ag(+) efflux RND transporter permease subunit SilA	plus	STRESS	METAL	COPPER/SILVER	COPPER/SILVER	BLASTX	1048	1048	100.00	98.85	1048	AAD11749.1	Cu(+)/Ag(+) efflux RND transporter permease subunit SilA	NA	NA
24ARS-JLM0020	NA	24ARS-JLM0020_04815	1	1290	+	silB	Cu(+)/Ag(+) efflux RND transporter periplasmic adaptor subunit SilB	plus	STRESS	METAL	COPPER/SILVER	COPPER/SILVER	BLASTX	430	430	100.00	97.91	430	AAD11748.1	Cu(+)/Ag(+) efflux RND transporter periplasmic adaptor subunit SilB	NA	NA
24ARS-JLM0020	NA	24ARS-JLM0020_04816	1	351	+	silF	Cu(+)/Ag(+) efflux RND transporter periplasmic metallochaperone SilF	plus	STRESS	METAL	COPPER/SILVER	COPPER/SILVER	BLASTX	117	117	100.00	99.15	117	KGL71342.1	Cu(+)/Ag(+) efflux RND transporter periplasmic metallochaperone SilF	NA	NA
24ARS-JLM0020	NA	24ARS-JLM0020_04817	1	1383	+	silC	Cu(+)/Ag(+) efflux RND transporter outer membrane channel SilC	plus	STRESS	METAL	COPPER/SILVER	COPPER/SILVER	BLASTX	461	461	100.00	98.26	461	SPD96884.1	Cu(+)/Ag(+) efflux RND transporter outer membrane channel SilC	NA	NA
24ARS-JLM0020	NA	24ARS-JLM0020_04818	1	678	+	silR	copper/silver response regulator transcription factor SilR	plus	STRESS	METAL	COPPER/SILVER	COPPER/SILVER	BLASTX	226	226	100.00	98.23	226	SPD96883.1	copper/silver response regulator transcription factor SilR	NA	NA
24ARS-JLM0020	NA	24ARS-JLM0020_04819	1	1473	+	silS	copper/silver sensor histidine kinase SilS	plus	STRESS	METAL	COPPER/SILVER	COPPER/SILVER	BLASTX	491	491	100.00	98.98	491	SPD96882.1	copper/silver sensor histidine kinase SilS	NA	NA
24ARS-JLM0020	NA	24ARS-JLM0020_04820	1	429	+	silE	silver-binding protein SilE	plus	STRESS	METAL	SILVER	SILVER	BLASTX	143	143	100.00	92.31	143	AAD11743.1	silver-binding protein SilE	NA	NA
24ARS-JLM0020	NA	24ARS-JLM0020_05035	1	495	+	dfrA12	trimethoprim-resistant dihydrofolate reductase DfrA12	core	AMR	AMR	TRIMETHOPRIM	TRIMETHOPRIM	EXACTX	165	165	100.00	100.00	165	WP_001083725.1	trimethoprim-resistant dihydrofolate reductase DfrA12	NA	NA
24ARS-JLM0020	NA	24ARS-JLM0020_05036	1	777	+	aadA2	ANT(3'')-Ia family aminoglycoside nucleotidyltransferase AadA2	core	AMR	AMR	AMINOGLYCOSIDE	STREPTOMYCIN	BLASTX	259	263	98.48	100.00	259	WP_001206356.1	ANT(3'')-Ia family aminoglycoside nucleotidyltransferase AadA2	NA	NA
24ARS-JLM0020	NA	24ARS-JLM0020_05037	1	345	+	qacEdelta1	quaternary ammonium compound efflux SMR transporter QacE delta 1	core	STRESS	BIOCIDE	QUATERNARY AMMONIUM	QUATERNARY AMMONIUM	ALLELEX	115	115	100.00	100.00	115	WP_000679427.1	quaternary ammonium compound efflux SMR transporter QacE delta 1	NA	NA
24ARS-JLM0020	NA	24ARS-JLM0020_05038	1	837	+	sul1	sulfonamide-resistant dihydropteroate synthase Sul1	core	AMR	AMR	SULFONAMIDE	SULFONAMIDE	EXACTX	279	279	100.00	100.00	279	WP_000259031.1	sulfonamide-resistant dihydropteroate synthase Sul1	NA	NA
24ARS-JLM0020	NA	24ARS-JLM0020_05045	1	903	+	mph(A)	Mph(A) family macrolide 2'-phosphotransferase	core	AMR	AMR	MACROLIDE	AZITHROMYCIN/ERYTHROMYCIN/SPIRAMYCIN/TELITHROMYCIN	EXACTX	301	301	100.00	100.00	301	WP_000219391.1	Mph(A) family macrolide 2'-phosphotransferase	NA	NA
24ARS-JLM0020	NA	24ARS-JLM0020_05125	1	873	+	blaCTX-M-15	extended-spectrum class A beta-lactamase CTX-M-15	core	AMR	AMR	BETA-LACTAM	CEPHALOSPORIN	ALLELEX	291	291	100.00	100.00	291	WP_000239590.1	extended-spectrum class A beta-lactamase CTX-M-15	NA	NA
24ARS-JLM0020	NA	24ARS-JLM0020_05132	1	654	+	qnrS1	quinolone resistance pentapeptide repeat protein QnrS1	core	AMR	AMR	QUINOLONE	QUINOLONE	ALLELEX	218	218	100.00	100.00	218	WP_001516695.1	quinolone resistance pentapeptide repeat protein QnrS1	NA	NA
