Name	Protein identifier	Contig id	Start	Stop	Strand	Gene symbol	Sequence name	Scope	Element type	Element subtype	Class	Subclass	Method	Target length	Reference sequence length	% Coverage of reference sequence	% Identity to reference sequence	Alignment length	Accession of closest sequence	Name of closest sequence	HMM id	HMM description
24ARS-NKI0053	NA	24ARS-NKI0053_02430	1	783	+	aph(3')-IIb	aminoglycoside O-phosphotransferase APH(3')-IIb	core	AMR	AMR	AMINOGLYCOSIDE	KANAMYCIN	BLASTX	261	268	97.39	99.62	261	WP_003113011.1	aminoglycoside O-phosphotransferase APH(3')-IIb	NA	NA
UTP-BL-006	NA	UTP-BL-006_00049	1	873	+	blaCTX-M-15	extended-spectrum class A beta-lactamase CTX-M-15	core	AMR	AMR	BETA-LACTAM	CEPHALOSPORIN	ALLELEX	291	291	100.00	100.00	291	WP_000239590.1	extended-spectrum class A beta-lactamase CTX-M-15	NA	NA
UTP-BL-006	NA	UTP-BL-006_00119	1	1800	+	ybtP	yersiniabactin ABC transporter ATP-binding/permease protein YbtP	plus	VIRULENCE	VIRULENCE	NA	NA	BLASTX	600	600	100.00	99.67	600	CAA21388.1	yersiniabactin ABC transporter ATP-binding/permease protein YbtP	NA	NA
UTP-BL-006	NA	UTP-BL-006_00120	1	1800	+	ybtQ	yersiniabactin ABC transporter ATP-binding/permease protein YbtQ	plus	VIRULENCE	VIRULENCE	NA	NA	BLASTX	600	600	100.00	99.50	600	AAC69584.1	yersiniabactin ABC transporter ATP-binding/permease protein YbtQ	NA	NA
UTP-BL-006	NA	UTP-BL-006_00496	1	306	+	asr	acid resistance repetitive basic protein Asr	plus	STRESS	ACID	NA	NA	BLASTX	102	102	100.00	98.04	102	BAA15331.2	acid resistance repetitive basic protein Asr	NA	NA
UTP-BL-006	NA	UTP-BL-006_00915	1	330	+	emrE	multidrug efflux SMR transporter EmrE	plus	STRESS	BIOCIDE	EFFLUX	EFFLUX	EXACTX	110	110	100.00	100.00	110	CAA77936.1	multidrug efflux SMR transporter EmrE	NA	NA
UTP-BL-006	NA	UTP-BL-006_01163	1	4245	+	fdeC	inverse autotransporter adhesin FdeC	plus	VIRULENCE	VIRULENCE	NA	NA	BLASTX	1415	1416	100.00	92.51	1416	ABE05822.1	inverse autotransporter adhesin FdeC	NA	NA
UTP-BL-006	NA	UTP-BL-006_01329	1	1131	+	blaEC	BlaEC family class C beta-lactamase	plus	AMR	AMR	BETA-LACTAM	BETA-LACTAM	BLASTX	377	377	100.00	99.73	377	WP_063860263.1	extended-spectrum class C beta-lactamase EC-19	NA	NA
UTP-BL-006	NA	UTP-BL-006_01496	1	1227	+	mdtM	multidrug efflux MFS transporter MdtM	plus	AMR	AMR	EFFLUX	EFFLUX	BLASTX	409	410	99.76	97.56	409	AAC77293.1	multidrug efflux MFS transporter MdtM	NA	NA
UTP-BL-006	NA	UTP-BL-006_01856	1	351	+	arsR	As(III)-sensing metalloregulatory transcriptional repressor ArsR	plus	STRESS	METAL	ARSENIC	ARSENIC	BLASTX	117	117	100.00	96.58	117	BAE77793.1	As(III)-sensing metalloregulatory transcriptional repressor ArsR	NA	NA
UTP-BL-006	NA	UTP-BL-006_01858	1	423	+	arsC	glutaredoxin-dependent arsenate reductase	plus	STRESS	METAL	ARSENIC	ARSENATE	BLASTX	141	141	100.00	92.20	141	AAA21096.1	glutaredoxin-dependent arsenate reductase	NA	NA
UTP-BL-006	NA	UTP-BL-006_02426	1	3102	+	acrF	multidrug efflux RND transporter permease subunit AcrF	plus	AMR	AMR	EFFLUX	EFFLUX	BLASTX	1034	1034	100.00	99.42	1034	AAC76298.1	multidrug efflux RND transporter permease subunit AcrF	NA	NA
UTP-BL-006	NA	UTP-BL-006_03264	1	900	+	fieF	CDF family cation-efflux transporter FieF	plus	STRESS	METAL	NA	NA	BLASTX	300	300	100.00	99.67	300	BAE77395.1	CDF family cation-efflux transporter FieF	NA	NA
UTP-BL-006	NA	UTP-BL-006_03447	1	1695	+	eilA	HilA family transcriptional regulator EilA	plus	VIRULENCE	VIRULENCE	NA	NA	BLASTX	565	565	100.00	99.82	565	ACB16655.1	HilA family transcriptional regulator EilA	NA	NA
UTP-BL-006	NA	UTP-BL-006_03577	1	1182	+	emrD	multidrug efflux MFS transporter EmrD	plus	AMR	AMR	EFFLUX	EFFLUX	BLASTX	394	394	100.00	99.75	394	BAE77620.1	multidrug efflux MFS transporter EmrD	NA	NA
UTP-BL-006	NA	UTP-BL-006_03629	1	570	+	lpfA-O113	long polar fimbria major subunit LpfA-O113	plus	VIRULENCE	VIRULENCE	NA	NA	EXACTX	190	190	100.00	100.00	190	ACB16424.1	long polar fimbria major subunit LpfA-O113	NA	NA
UTP-BL-006	NA	UTP-BL-006_03898	1	264	+	ariR	biofilm/acid-resistance regulator AriR	plus	STRESS	ACID	NA	NA	BLASTX	88	88	100.00	97.73	88	AAC74250.1	biofilm/acid-resistance regulator AriR	NA	NA
UTP-BL-006	NA	UTP-BL-006_04217	1	795	+	aggR	aggregative adherence transcriptional regulator AggR	plus	VIRULENCE	VIRULENCE	NA	NA	EXACTX	265	265	100.00	100.00	265	CAA83535.1	aggregative adherence transcriptional regulator AggR	NA	NA
UTP-BL-006	NA	UTP-BL-006_04218	1	348	+	aap	dispersin Aap	plus	VIRULENCE	VIRULENCE	NA	NA	BLASTX	116	116	100.00	96.55	116	CBG27807.1	dispersin Aap	NA	NA
UTP-BL-006	NA	UTP-BL-006_04219	1	198	+	aar	AggR-activated transcriptional regulator Aar	plus	VIRULENCE	VIRULENCE	NA	NA	BLASTX	66	66	100.00	98.48	66	ASK37426.1	AggR-activated transcriptional regulator Aar	NA	NA
UTP-BL-006	NA	UTP-BL-006_04225	1	1236	+	aatA	dispersin export ABC transporter outer membrane protein AatA	plus	VIRULENCE	VIRULENCE	NA	NA	BLASTX	412	412	100.00	99.76	412	CAU95796.1	dispersin export ABC transporter outer membrane protein AatA	NA	NA
UTP-BL-006	NA	UTP-BL-006_04274	1	858	+	blaTEM-1	broad-spectrum class A beta-lactamase TEM-1	core	AMR	AMR	BETA-LACTAM	BETA-LACTAM	ALLELEX	286	286	100.00	100.00	286	WP_000027057.1	broad-spectrum class A beta-lactamase TEM-1	NA	NA
UTP-BL-006	NA	UTP-BL-006_04308	50	163	+	astA	heat-stable enterotoxin EAST1	plus	VIRULENCE	VIRULENCE	NA	NA	BLASTX	38	38	100.00	97.37	38	AAA20885.1	heat-stable enterotoxin EAST1	NA	NA
UTP-BL-006	NA	UTP-BL-006_04309	1	516	+	aggA	aggregative adherence fimbria I major subunit AggA	plus	VIRULENCE	VIRULENCE	NA	NA	EXACTX	172	172	100.00	100.00	172	EMS03085.1	aggregative adherence fimbria I major subunit AggA	NA	NA
UTP-BL-006	NA	UTP-BL-006_04310	1	435	+	aggB	aggregative adherence fimbria I minor subunit AggB	plus	VIRULENCE	VIRULENCE	NA	NA	BLASTX	145	145	100.00	97.93	145	EHF16297.1	aggregative adherence fimbria I minor subunit AggB	NA	NA
UTP-BL-006	NA	UTP-BL-006_04311	1	2526	+	aggC	aggregative adherence fimbria I usher protein AggC	plus	VIRULENCE	VIRULENCE	NA	NA	BLASTX	842	842	100.00	99.76	842	AAA57452.1	aggregative adherence fimbria I usher protein AggC	NA	NA
UTP-BL-006	NA	UTP-BL-006_04312	1	627	+	aggD	aggregative adherence fimbria I chaperone AggD	plus	VIRULENCE	VIRULENCE	NA	NA	PARTIAL_CONTIG_ENDX	209	252	82.94	99.52	209	AAA57451.1	aggregative adherence fimbria I chaperone AggD	NA	NA
24ARS-NKI0050	NA	24ARS-NKI0050_00308	1	417	+	fosA	FosA5 family fosfomycin resistance glutathione transferase	core	AMR	AMR	FOSFOMYCIN	FOSFOMYCIN	EXACTX	139	139	100.00	100.00	139	WP_004146118.1	FosA5 family fosfomycin resistance glutathione transferase	NA	NA
24ARS-NKI0050	NA	24ARS-NKI0050_00607	1	858	+	blaSHV-1	broad-spectrum class A beta-lactamase SHV-1	core	AMR	AMR	BETA-LACTAM	BETA-LACTAM	ALLELEX	286	286	100.00	100.00	286	WP_001620095.1	broad-spectrum class A beta-lactamase SHV-1	NA	NA
24ARS-NKI0050	NA	24ARS-NKI0050_01151	1	1173	+	oqxA	multidrug efflux RND transporter periplasmic adaptor subunit OqxA	core	AMR	AMR	PHENICOL/QUINOLONE	PHENICOL/QUINOLONE	BLASTX	391	391	100.00	99.74	391	WP_002914189.1	multidrug efflux RND transporter periplasmic adaptor subunit OqxA	NA	NA
24ARS-NKI0050	NA	24ARS-NKI0050_01152	1	3150	+	oqxB25	multidrug efflux RND transporter permease subunit OqxB25	core	AMR	AMR	PHENICOL/QUINOLONE	PHENICOL/QUINOLONE	ALLELEX	1050	1050	100.00	100.00	1050	WP_016947602.1	multidrug efflux RND transporter permease subunit OqxB25	NA	NA
24ARS-NKI0050	NA	24ARS-NKI0050_01400	1	1800	+	ybtQ	yersiniabactin ABC transporter ATP-binding/permease protein YbtQ	plus	VIRULENCE	VIRULENCE	NA	NA	BLASTX	600	600	100.00	99.67	600	AAC69584.1	yersiniabactin ABC transporter ATP-binding/permease protein YbtQ	NA	NA
24ARS-NKI0050	NA	24ARS-NKI0050_01401	1	1710	+	ybtP	yersiniabactin ABC transporter ATP-binding/permease protein YbtP	plus	VIRULENCE	VIRULENCE	NA	NA	BLASTX	570	600	95.00	99.82	570	CAA21388.1	yersiniabactin ABC transporter ATP-binding/permease protein YbtP	NA	NA
24ARS-NKI0050	NA	24ARS-NKI0050_03275	1	1182	+	emrD	multidrug efflux MFS transporter EmrD	plus	AMR	AMR	EFFLUX	EFFLUX	BLASTX	394	394	100.00	99.49	394	ACN65732.1	multidrug efflux MFS transporter EmrD	NA	NA
24ARS-NKI0050	NA	24ARS-NKI0050_03642	1	429	+	silE	silver-binding protein SilE	plus	STRESS	METAL	SILVER	SILVER	BLASTX	143	143	100.00	88.11	143	AAD11743.1	silver-binding protein SilE	NA	NA
24ARS-NKI0050	NA	24ARS-NKI0050_03643	1	1473	+	silS	copper/silver sensor histidine kinase SilS	plus	STRESS	METAL	COPPER/SILVER	COPPER/SILVER	BLASTX	491	491	100.00	98.98	491	SPD96882.1	copper/silver sensor histidine kinase SilS	NA	NA
24ARS-NKI0050	NA	24ARS-NKI0050_03644	1	678	+	silR	copper/silver response regulator transcription factor SilR	plus	STRESS	METAL	COPPER/SILVER	COPPER/SILVER	BLASTX	226	226	100.00	97.35	226	SPD96883.1	copper/silver response regulator transcription factor SilR	NA	NA
24ARS-NKI0050	NA	24ARS-NKI0050_03645	1	1383	+	silC	Cu(+)/Ag(+) efflux RND transporter outer membrane channel SilC	plus	STRESS	METAL	COPPER/SILVER	COPPER/SILVER	BLASTX	461	461	100.00	99.35	461	SPD96884.1	Cu(+)/Ag(+) efflux RND transporter outer membrane channel SilC	NA	NA
24ARS-NKI0050	NA	24ARS-NKI0050_03646	1	360	+	silF	Cu(+)/Ag(+) efflux RND transporter periplasmic metallochaperone SilF	plus	STRESS	METAL	COPPER/SILVER	COPPER/SILVER	BLASTX	120	117	100.00	94.17	120	KGL71342.1	Cu(+)/Ag(+) efflux RND transporter periplasmic metallochaperone SilF	NA	NA
24ARS-NKI0050	NA	24ARS-NKI0050_03647	1	1290	+	silB	Cu(+)/Ag(+) efflux RND transporter periplasmic adaptor subunit SilB	plus	STRESS	METAL	COPPER/SILVER	COPPER/SILVER	BLASTX	430	430	100.00	98.14	430	AAD11748.1	Cu(+)/Ag(+) efflux RND transporter periplasmic adaptor subunit SilB	NA	NA
24ARS-NKI0050	NA	24ARS-NKI0050_03648	1	3144	+	silA	Cu(+)/Ag(+) efflux RND transporter permease subunit SilA	plus	STRESS	METAL	COPPER/SILVER	COPPER/SILVER	BLASTX	1048	1048	100.00	98.85	1048	AAD11749.1	Cu(+)/Ag(+) efflux RND transporter permease subunit SilA	NA	NA
24ARS-NKI0050	NA	24ARS-NKI0050_03650	1	2445	+	silP	Ag(+)-translocating P-type ATPase SilP	plus	STRESS	METAL	SILVER	SILVER	BLASTX	815	824	98.79	94.61	816	AAD11750.1	Ag(+)-translocating P-type ATPase SilP	NA	NA
24ARS-NKI0050	NA	24ARS-NKI0050_03654	1	1815	+	pcoA	multicopper oxidase PcoA	plus	STRESS	METAL	COPPER	COPPER	BLASTX	605	605	100.00	99.83	605	CAA58525.1	multicopper oxidase PcoA	NA	NA
24ARS-NKI0050	NA	24ARS-NKI0050_03655	7	894	+	pcoB	copper-binding protein PcoB	plus	STRESS	METAL	COPPER	COPPER	BLASTX	296	296	100.00	99.66	296	CAA58526.1	copper-binding protein PcoB	NA	NA
24ARS-NKI0050	NA	24ARS-NKI0050_03656	1	378	+	pcoC	copper resistance system metallochaperone PcoC	plus	STRESS	METAL	COPPER	COPPER	EXACTX	126	126	100.00	100.00	126	CAA58527.1	copper resistance system metallochaperone PcoC	NA	NA
24ARS-NKI0050	NA	24ARS-NKI0050_03657	1	927	+	pcoD	copper resistance inner membrane protein PcoD	plus	STRESS	METAL	COPPER	COPPER	BLASTX	309	309	100.00	99.35	309	CAA58528.1	copper resistance inner membrane protein PcoD	NA	NA
24ARS-NKI0050	NA	24ARS-NKI0050_03658	1	678	+	pcoR	copper response regulator transcription factor PcoR	plus	STRESS	METAL	COPPER	COPPER	EXACTX	226	226	100.00	100.00	226	CAA58529.1	copper response regulator transcription factor PcoR	NA	NA
24ARS-NKI0050	NA	24ARS-NKI0050_03659	1	1398	+	pcoS	copper resistance membrane spanning protein PcoS	plus	STRESS	METAL	COPPER	COPPER	BLASTX	466	466	100.00	99.14	466	CAA58530.1	copper resistance membrane spanning protein PcoS	NA	NA
24ARS-NKI0050	NA	24ARS-NKI0050_03720	1	1113	+	iroB	salmochelin biosynthesis C-glycosyltransferase IroB	plus	VIRULENCE	VIRULENCE	NA	NA	BLASTX	371	371	100.00	90.30	371	EOW04219.1	salmochelin biosynthesis C-glycosyltransferase IroB	NA	NA
24ARS-NKI0050	NA	24ARS-NKI0050_03721	1	3636	+	iroC	salmochelin/enterobactin export ABC transporter IroC	plus	VIRULENCE	VIRULENCE	NA	NA	BLASTX	1212	1219	99.51	88.95	1213	AUH19662.1	salmochelin/enterobactin export ABC transporter IroC	NA	NA
24ARS-NKI0050	NA	24ARS-NKI0050_03722	1	1227	+	iroD	catecholate siderophore esterase IroD	plus	VIRULENCE	VIRULENCE	NA	NA	BLASTX	409	409	100.00	98.78	409	AVE24993.1	catecholate siderophore esterase IroD	NA	NA
24ARS-NKI0050	NA	24ARS-NKI0050_03723	1	2172	+	iroN	siderophore salmochelin receptor IroN	plus	VIRULENCE	VIRULENCE	NA	NA	EXACTX	724	724	100.00	100.00	724	BAH65949.1	siderophore salmochelin receptor IroN	NA	NA
24ARS-NKI0050	NA	24ARS-NKI0050_03725	1	900	+	peg-344	DMT family inner membrane transporter PEG344	plus	VIRULENCE	VIRULENCE	NA	NA	EXACTX	300	300	100.00	100.00	300	BAH65947.1	DMT family inner membrane transporter PEG344	NA	NA
24ARS-NKI0050	NA	24ARS-NKI0050_03726	151	546	+	rmpC	mucoid phenotype regulator RmpC	plus	VIRULENCE	VIRULENCE	NA	NA	BLASTX	132	133	99.25	90.91	132	AIK83625.1	mucoid phenotype regulator RmpC	NA	NA
24ARS-NKI0050	NA	24ARS-NKI0050_03727	1	585	+	rmpA	mucoid phenotype regulator RmpA	plus	VIRULENCE	VIRULENCE	NA	NA	BLASTX	195	210	92.86	100.00	195	AMA27886.1	mucoid phenotype regulator RmpA	NA	NA
24ARS-NKI0050	NA	24ARS-NKI0050_03965	1	1230	+	kdeA	multidrug efflux MFS transporter KdeA	plus	AMR	AMR	EFFLUX	EFFLUX	BLASTX	410	410	100.00	99.76	410	ABR76310.1	multidrug efflux MFS transporter KdeA	NA	NA
24ARS-NKI0050	NA	24ARS-NKI0050_04298	1	900	+	fieF	CDF family cation-efflux transporter FieF	plus	STRESS	METAL	NA	NA	EXACTX	300	300	100.00	100.00	300	BAB89353.1	CDF family cation-efflux transporter FieF	NA	NA
24ARS-NKI0050	NA	24ARS-NKI0050_04665	1	573	+	terE	tellurium resistance cAMP binding protein TerE	plus	STRESS	METAL	TELLURIUM	TELLURIUM	BLASTX	191	191	100.00	99.48	191	AAA98293.1	tellurium resistance cAMP binding protein TerE	NA	NA
24ARS-NKI0050	NA	24ARS-NKI0050_04666	1	576	+	terD	tellurium resistance membrane protein TerD	plus	STRESS	METAL	TELLURIUM	TELLURIUM	BLASTX	192	192	100.00	98.96	192	AAA98292.1	tellurium resistance membrane protein TerD	NA	NA
24ARS-NKI0050	NA	24ARS-NKI0050_04667	1	1038	+	terC	tellurium resistance membrane protein TerC	plus	STRESS	METAL	TELLURIUM	TELLURIUM	BLASTX	346	346	100.00	99.13	346	AAA98291.1	tellurium resistance membrane protein TerC	NA	NA
24ARS-NKI0050	NA	24ARS-NKI0050_04668	1	453	+	terB	tellurium resistance membrane protein TerB	plus	STRESS	METAL	TELLURIUM	TELLURIUM	EXACTX	151	151	100.00	100.00	151	ACI12150.1	tellurium resistance membrane protein TerB	NA	NA
24ARS-NKI0050	NA	24ARS-NKI0050_05027	13	2199	+	iutA	ferric aerobactin receptor IutA	plus	VIRULENCE	VIRULENCE	NA	NA	BLASTX	729	731	99.73	89.57	729	AAN45165.2	ferric aerobactin receptor IutA	NA	NA
24ARS-NKI0050	NA	24ARS-NKI0050_05029	1	1731	+	iucC	NIS family aerobactin synthetase IucC	plus	VIRULENCE	VIRULENCE	NA	NA	BLASTX	577	580	99.48	92.72	577	AAN82073.1	NIS family aerobactin synthetase IucC	NA	NA
24ARS-NKI0050	NA	24ARS-NKI0050_05030	1	945	+	iucB	N(6)-hydroxylysine O-acetyltransferase IucB	plus	VIRULENCE	VIRULENCE	NA	NA	BLASTX	315	315	100.00	94.60	315	AAN82074.1	N(6)-hydroxylysine O-acetyltransferase IucB	NA	NA
24ARS-NKI0050	NA	24ARS-NKI0050_05031	58	1776	+	iucA	aerobactin synthase IucA	plus	VIRULENCE	VIRULENCE	NA	NA	BLASTX	573	576	99.83	90.09	575	EGI25746.1	aerobactin synthase IucA	NA	NA
24ARS-STU0024	NA	24ARS-STU0024_00679	1	1800	+	ybtQ	yersiniabactin ABC transporter ATP-binding/permease protein YbtQ	plus	VIRULENCE	VIRULENCE	NA	NA	BLASTX	600	600	100.00	99.50	600	AAC69584.1	yersiniabactin ABC transporter ATP-binding/permease protein YbtQ	NA	NA
24ARS-STU0024	NA	24ARS-STU0024_00680	1	1710	+	ybtP	yersiniabactin ABC transporter ATP-binding/permease protein YbtP	plus	VIRULENCE	VIRULENCE	NA	NA	BLASTX	570	600	95.00	99.82	570	CAA21388.1	yersiniabactin ABC transporter ATP-binding/permease protein YbtP	NA	NA
24ARS-STU0024	NA	24ARS-STU0024_01244	1	1173	+	oqxA	multidrug efflux RND transporter periplasmic adaptor subunit OqxA	core	AMR	AMR	PHENICOL/QUINOLONE	PHENICOL/QUINOLONE	EXACTX	391	391	100.00	100.00	391	WP_002914189.1	multidrug efflux RND transporter periplasmic adaptor subunit OqxA	NA	NA
24ARS-STU0024	NA	24ARS-STU0024_01245	1	3150	+	oqxB32	multidrug efflux RND transporter permease subunit OqxB32	core	AMR	AMR	PHENICOL/QUINOLONE	PHENICOL/QUINOLONE	ALLELEX	1050	1050	100.00	100.00	1050	WP_023342632.1	multidrug efflux RND transporter permease subunit OqxB32	NA	NA
24ARS-STU0024	NA	24ARS-STU0024_01640	1	858	+	blaSHV-11	broad-spectrum class A beta-lactamase SHV-11	core	AMR	AMR	BETA-LACTAM	BETA-LACTAM	ALLELEX	286	286	100.00	100.00	286	WP_004176269.1	broad-spectrum class A beta-lactamase SHV-11	NA	NA
24ARS-STU0024	NA	24ARS-STU0024_02343	1	813	+	sul2	sulfonamide-resistant dihydropteroate synthase Sul2	core	AMR	AMR	SULFONAMIDE	SULFONAMIDE	EXACTX	271	271	100.00	100.00	271	WP_001043260.1	sulfonamide-resistant dihydropteroate synthase Sul2	NA	NA
24ARS-STU0024	NA	24ARS-STU0024_02344	1	801	+	aph(3'')-Ib	aminoglycoside O-phosphotransferase APH(3'')-Ib	core	AMR	AMR	AMINOGLYCOSIDE	STREPTOMYCIN	BLASTX	267	267	100.00	99.63	267	WP_001082319.1	aminoglycoside O-phosphotransferase APH(3'')-Ib	NA	NA
24ARS-STU0024	NA	24ARS-STU0024_02345	1	834	+	aph(6)-Id	aminoglycoside O-phosphotransferase APH(6)-Id	core	AMR	AMR	AMINOGLYCOSIDE	STREPTOMYCIN	EXACTX	278	278	100.00	100.00	278	WP_000480972.1	aminoglycoside O-phosphotransferase APH(6)-Id	NA	NA
24ARS-STU0024	NA	24ARS-STU0024_02768	1	1230	+	kdeA	multidrug efflux MFS transporter KdeA	plus	AMR	AMR	EFFLUX	EFFLUX	EXACTX	410	410	100.00	100.00	410	ABR76310.1	multidrug efflux MFS transporter KdeA	NA	NA
24ARS-STU0024	NA	24ARS-STU0024_03985	1	1179	+	emrD	multidrug efflux MFS transporter EmrD	plus	AMR	AMR	EFFLUX	EFFLUX	BLASTX	393	394	99.75	99.75	393	ACN65732.1	multidrug efflux MFS transporter EmrD	NA	NA
24ARS-STU0024	NA	24ARS-STU0024_04066	1	900	+	fieF	CDF family cation-efflux transporter FieF	plus	STRESS	METAL	NA	NA	EXACTX	300	300	100.00	100.00	300	BAB89353.1	CDF family cation-efflux transporter FieF	NA	NA
24ARS-STU0024	NA	24ARS-STU0024_04342	127	597	+	dfrA7	trimethoprim-resistant dihydrofolate reductase DfrA7	core	AMR	AMR	TRIMETHOPRIM	TRIMETHOPRIM	EXACTX	157	157	100.00	100.00	157	WP_000703418.1	trimethoprim-resistant dihydrofolate reductase DfrA7	NA	NA
24ARS-STU0024	NA	24ARS-STU0024_04343	1	345	+	qacEdelta1	quaternary ammonium compound efflux SMR transporter QacE delta 1	core	STRESS	BIOCIDE	QUATERNARY AMMONIUM	QUATERNARY AMMONIUM	ALLELEX	115	115	100.00	100.00	115	WP_000679427.1	quaternary ammonium compound efflux SMR transporter QacE delta 1	NA	NA
24ARS-STU0024	NA	24ARS-STU0024_04344	1	837	+	sul1	sulfonamide-resistant dihydropteroate synthase Sul1	core	AMR	AMR	SULFONAMIDE	SULFONAMIDE	EXACTX	279	279	100.00	100.00	279	WP_000259031.1	sulfonamide-resistant dihydropteroate synthase Sul1	NA	NA
24ARS-STU0024	NA	24ARS-STU0024_04787	1	429	+	silE	silver-binding protein SilE	plus	STRESS	METAL	SILVER	SILVER	BLASTX	143	143	100.00	92.31	143	AAD11743.1	silver-binding protein SilE	NA	NA
24ARS-STU0024	NA	24ARS-STU0024_04788	1	1473	+	silS	copper/silver sensor histidine kinase SilS	plus	STRESS	METAL	COPPER/SILVER	COPPER/SILVER	BLASTX	491	491	100.00	98.98	491	SPD96882.1	copper/silver sensor histidine kinase SilS	NA	NA
24ARS-STU0024	NA	24ARS-STU0024_04789	1	678	+	silR	copper/silver response regulator transcription factor SilR	plus	STRESS	METAL	COPPER/SILVER	COPPER/SILVER	BLASTX	226	226	100.00	98.23	226	SPD96883.1	copper/silver response regulator transcription factor SilR	NA	NA
24ARS-STU0024	NA	24ARS-STU0024_04790	1	1383	+	silC	Cu(+)/Ag(+) efflux RND transporter outer membrane channel SilC	plus	STRESS	METAL	COPPER/SILVER	COPPER/SILVER	BLASTX	461	461	100.00	98.26	461	SPD96884.1	Cu(+)/Ag(+) efflux RND transporter outer membrane channel SilC	NA	NA
24ARS-STU0024	NA	24ARS-STU0024_04791	1	351	+	silF	Cu(+)/Ag(+) efflux RND transporter periplasmic metallochaperone SilF	plus	STRESS	METAL	COPPER/SILVER	COPPER/SILVER	BLASTX	117	117	100.00	99.15	117	KGL71342.1	Cu(+)/Ag(+) efflux RND transporter periplasmic metallochaperone SilF	NA	NA
24ARS-STU0024	NA	24ARS-STU0024_04792	1	1290	+	silB	Cu(+)/Ag(+) efflux RND transporter periplasmic adaptor subunit SilB	plus	STRESS	METAL	COPPER/SILVER	COPPER/SILVER	BLASTX	430	430	100.00	97.91	430	AAD11748.1	Cu(+)/Ag(+) efflux RND transporter periplasmic adaptor subunit SilB	NA	NA
24ARS-STU0024	NA	24ARS-STU0024_04793	1	3144	+	silA	Cu(+)/Ag(+) efflux RND transporter permease subunit SilA	plus	STRESS	METAL	COPPER/SILVER	COPPER/SILVER	BLASTX	1048	1048	100.00	98.85	1048	AAD11749.1	Cu(+)/Ag(+) efflux RND transporter permease subunit SilA	NA	NA
24ARS-STU0024	NA	24ARS-STU0024_04795	1	2445	+	silP	Ag(+)-translocating P-type ATPase SilP	plus	STRESS	METAL	SILVER	SILVER	BLASTX	815	824	98.79	94.73	816	AAD11750.1	Ag(+)-translocating P-type ATPase SilP	NA	NA
24ARS-STU0024	NA	24ARS-STU0024_04799	1	1815	+	pcoA	multicopper oxidase PcoA	plus	STRESS	METAL	COPPER	COPPER	EXACTX	605	605	100.00	100.00	605	CAA58525.1	multicopper oxidase PcoA	NA	NA
24ARS-STU0024	NA	24ARS-STU0024_04800	7	894	+	pcoB	copper-binding protein PcoB	plus	STRESS	METAL	COPPER	COPPER	BLASTX	296	296	100.00	99.66	296	CAA58526.1	copper-binding protein PcoB	NA	NA
24ARS-STU0024	NA	24ARS-STU0024_04801	1	378	+	pcoC	copper resistance system metallochaperone PcoC	plus	STRESS	METAL	COPPER	COPPER	EXACTX	126	126	100.00	100.00	126	CAA58527.1	copper resistance system metallochaperone PcoC	NA	NA
24ARS-STU0024	NA	24ARS-STU0024_04802	1	927	+	pcoD	copper resistance inner membrane protein PcoD	plus	STRESS	METAL	COPPER	COPPER	BLASTX	309	309	100.00	99.68	309	CAA58528.1	copper resistance inner membrane protein PcoD	NA	NA
24ARS-STU0024	NA	24ARS-STU0024_04803	1	678	+	pcoR	copper response regulator transcription factor PcoR	plus	STRESS	METAL	COPPER	COPPER	EXACTX	226	226	100.00	100.00	226	CAA58529.1	copper response regulator transcription factor PcoR	NA	NA
24ARS-STU0024	NA	24ARS-STU0024_04804	1	1398	+	pcoS	copper resistance membrane spanning protein PcoS	plus	STRESS	METAL	COPPER	COPPER	BLASTX	466	466	100.00	99.14	466	CAA58530.1	copper resistance membrane spanning protein PcoS	NA	NA
24ARS-STU0024	NA	24ARS-STU0024_04859	1	453	+	terB	tellurium resistance membrane protein TerB	plus	STRESS	METAL	TELLURIUM	TELLURIUM	EXACTX	151	151	100.00	100.00	151	ACI12150.1	tellurium resistance membrane protein TerB	NA	NA
24ARS-STU0024	NA	24ARS-STU0024_04860	1	1038	+	terC	tellurium resistance membrane protein TerC	plus	STRESS	METAL	TELLURIUM	TELLURIUM	BLASTX	346	346	100.00	99.13	346	AAA98291.1	tellurium resistance membrane protein TerC	NA	NA
24ARS-STU0024	NA	24ARS-STU0024_04861	1	576	+	terD	tellurium resistance membrane protein TerD	plus	STRESS	METAL	TELLURIUM	TELLURIUM	BLASTX	192	192	100.00	98.96	192	AAA98292.1	tellurium resistance membrane protein TerD	NA	NA
24ARS-STU0024	NA	24ARS-STU0024_04862	1	573	+	terE	tellurium resistance cAMP binding protein TerE	plus	STRESS	METAL	TELLURIUM	TELLURIUM	BLASTX	191	191	100.00	99.48	191	AAA98293.1	tellurium resistance cAMP binding protein TerE	NA	NA
24ARS-STU0024	NA	24ARS-STU0024_04944	1	414	+	fosA	FosA5 family fosfomycin resistance glutathione transferase	core	AMR	AMR	FOSFOMYCIN	FOSFOMYCIN	BLASTX	138	139	99.28	100.00	138	WP_004146118.1	FosA5 family fosfomycin resistance glutathione transferase	NA	NA
24ARS-STU0024	NA	24ARS-STU0024_05106	1	873	+	blaCTX-M-15	extended-spectrum class A beta-lactamase CTX-M-15	core	AMR	AMR	BETA-LACTAM	CEPHALOSPORIN	ALLELEX	291	291	100.00	100.00	291	WP_000239590.1	extended-spectrum class A beta-lactamase CTX-M-15	NA	NA
24ARS-STU0024	NA	24ARS-STU0024_05118	1	654	+	qnrS1	quinolone resistance pentapeptide repeat protein QnrS1	core	AMR	AMR	QUINOLONE	QUINOLONE	ALLELEX	218	218	100.00	100.00	218	WP_001516695.1	quinolone resistance pentapeptide repeat protein QnrS1	NA	NA
24ARS-STU0024	NA	24ARS-STU0024_05126	1	813	+	aph(3')-Ia	aminoglycoside O-phosphotransferase APH(3')-Ia	core	AMR	AMR	AMINOGLYCOSIDE	KANAMYCIN	EXACTX	271	271	100.00	100.00	271	WP_000018329.1	aminoglycoside O-phosphotransferase APH(3')-Ia	NA	NA
24ARS-CRH0017	NA	24ARS-CRH0017_00836	1	264	+	ariR	biofilm/acid-resistance regulator AriR	plus	STRESS	ACID	NA	NA	EXACTX	88	88	100.00	100.00	88	AAC74250.1	biofilm/acid-resistance regulator AriR	NA	NA
24ARS-CRH0017	NA	24ARS-CRH0017_01312	1	3102	+	acrF	multidrug efflux RND transporter permease subunit AcrF	plus	AMR	AMR	EFFLUX	EFFLUX	BLASTX	1034	1034	100.00	99.52	1034	AAC76298.1	multidrug efflux RND transporter permease subunit AcrF	NA	NA
24ARS-CRH0017	NA	24ARS-CRH0017_01949	1	4242	+	fdeC	inverse autotransporter adhesin FdeC	plus	VIRULENCE	VIRULENCE	NA	NA	BLASTX	1414	1416	99.93	91.10	1415	ABE05822.1	inverse autotransporter adhesin FdeC	NA	NA
24ARS-CRH0017	NA	24ARS-CRH0017_02443	1	1227	+	mdtM	multidrug efflux MFS transporter MdtM	plus	AMR	AMR	EFFLUX	EFFLUX	BLASTX	409	410	99.76	98.04	409	AAC77293.1	multidrug efflux MFS transporter MdtM	NA	NA
24ARS-CRH0017	NA	24ARS-CRH0017_02526	1	1182	+	emrD	multidrug efflux MFS transporter EmrD	plus	AMR	AMR	EFFLUX	EFFLUX	EXACTX	394	394	100.00	100.00	394	BAE77620.1	multidrug efflux MFS transporter EmrD	NA	NA
24ARS-CRH0017	NA	24ARS-CRH0017_02586	1	570	+	lpfA-O113	long polar fimbria major subunit LpfA-O113	plus	VIRULENCE	VIRULENCE	NA	NA	EXACTX	190	190	100.00	100.00	190	AAT76975.1	long polar fimbria major subunit LpfA-O113	NA	NA
24ARS-CRH0017	NA	24ARS-CRH0017_02939	1	306	+	asr	acid resistance repetitive basic protein Asr	plus	STRESS	ACID	NA	NA	BLASTX	102	102	100.00	97.06	102	BAA15331.2	acid resistance repetitive basic protein Asr	NA	NA
24ARS-CRH0017	NA	24ARS-CRH0017_03029	1	900	+	fieF	CDF family cation-efflux transporter FieF	plus	STRESS	METAL	NA	NA	EXACTX	300	300	100.00	100.00	300	BAE77395.1	CDF family cation-efflux transporter FieF	NA	NA
24ARS-CRH0017	NA	24ARS-CRH0017_03853	137	250	+	astA	heat-stable enterotoxin EAST1	plus	VIRULENCE	VIRULENCE	NA	NA	EXACTX	38	38	100.00	100.00	38	AAD43578.1	heat-stable enterotoxin EAST1	NA	NA
24ARS-CRH0017	NA	24ARS-CRH0017_03908	1	1131	+	blaEC	BlaEC family class C beta-lactamase	plus	AMR	AMR	BETA-LACTAM	BETA-LACTAM	BLASTX	377	377	100.00	99.73	377	WP_063610930.1	extended-spectrum class C beta-lactamase EC-15	NA	NA
24ARS-CRH0017	NA	24ARS-CRH0017_03955	1	1416	+	espX1	type III secretion system effector EspX1	plus	VIRULENCE	VIRULENCE	NA	NA	BLASTX	472	473	99.79	91.95	472	ADD54679.1	type III secretion system effector EspX1	NA	NA
